{
  "job_id": "manual-chatgpt-image:EXAMPLE-FRIDGE-001:S6:A6:0",
  "provider_id": "manual-chatgpt-image",
  "provider_mode": "manual",
  "operation": "derive_scene",
  "project_id": "EXAMPLE-FRIDGE-001",
  "scene_id": "S6",
  "output_asset_id": "A6",
  "reference_asset_ids": [
    "A0",
    "A1"
  ],
  "prompt": "IMAGE TASK: EDIT/DERIVE FROM APPROVED REFERENCE\nAsset: A6 | Scene: S6\nReference assets: A0, A1\nReference views: rear_left_45, rear\nSUBJECT IDENTITY LOCK\nA dark charcoal/black freestanding two-door top-freezer refrigerator matching the approved A0 canonical multi-view reference pack: rectangular body, upper freezer door smaller than lower refrigerator door, thin silver horizontal divider/trim between doors, minimal recessed vertical black handles along the left edge, flat dark side panels, compact household proportions.\nMust preserve:\n- dark charcoal/black body color\n- top-freezer two-door layout\n- upper freezer door smaller than lower refrigerator door\n- thin silver horizontal divider between doors\n- recessed vertical handle geometry on the left side\n- same height-to-width proportions as the product reference\n- same flat-sided rectangular body design\nMust never change:\n- do not convert to French-door, side-by-side, single-door, or bottom-freezer layout\n- do not change body color to white or stainless steel\n- do not add external water/ice dispenser\n- do not add large protruding handles\n- do not change door proportions\n- do not invent a different appliance model\nSCENE INTENT\nNarration: Do đó, mặt ngoài ấm lên có thể là một phần bình thường của quá trình làm lạnh.\nVisual goal: Return to the clean A1 exterior and subtly emphasize the designed heat-rejection area, keeping the scene realistic and non-alarming.\nViewer should understand:\n- some exterior warmth can be a normal consequence of heat rejection\n- the object is still the exact same refrigerator\n- the warm area should look normal, not dangerously overheated\nCAMERA\nView: Return to the exact A1 rear three-quarter view.\nAngle: Exact A1 camera angle.\nDistance: Exact A1 distance.\nHeight: Exact A1 height.\nFraming: Exact A1 framing.\nPerspective: Exact A1 perspective.\nLens style: Exact A1 lens character.\nCOMPOSITION\nSubject position: Exact A1 placement.\nBackground visibility: Exact A1 kitchen background.\nNegative space: Preserve A1 negative space.\nCrop rules:\n- full refrigerator visible\n- same margins as A1\n- no zoom that hides identity cues\nLayering:\n- base: A1\n- overlay: restrained warm-zone emphasis only\nENVIRONMENT\nLocation: Ordinary modern home kitchen with enough clearance around the refrigerator to view its side/rear area.\nFixed elements:\n- warm light-wood cabinetry\n- light neutral wall\n- simple light-colored tile or wood-look floor\n- one small green plant or modest kitchen accessory\n- no people\nAllowed changes:\n- small crop adjustments\n- subtle camera repositioning required by each scene\n- minor background blur consistent with the same kitchen\nForbidden changes:\n- no showroom or appliance-store setting\n- no industrial kitchen\n- no dramatic location change\n- no neon or sci-fi environment\n- no unrelated refrigerator in the background\nLIGHTING\nStyle: Natural residential daylight with soft practical kitchen fill.\nDirection: Main daylight from camera-right/front-right; soft fill from room lighting.\nIntensity: Moderate, realistic indoor exposure; refrigerator surfaces remain dark but readable.\nColor temperature: Neutral-warm daylight, approximately household natural-light appearance.\nConsistency rules:\n- keep shadow direction consistent across A1/A2/A5/A6\n- avoid dramatic rim light or studio spotlight\n- do not make the refrigerator glossy or mirror-like\nMATERIALS AND REALISM\nMaterials:\n- matte or satin dark-coated metal refrigerator exterior\n- thin brushed-metal/silver divider trim\n- ordinary painted kitchen walls\n- wood cabinetry\n- realistic floor material\nSurface finish:\n- subtle real-world texture\n- small natural reflections only\n- no perfect CGI plastic smoothness\nReality notes:\n- ordinary lived-in kitchen, not a product advertisement set\n- physically plausible contact shadows and floor reflections\n- straight edges remain geometrically consistent\n- no melted, duplicated, or warped appliance parts\nREQUIRED VISUAL ELEMENTS\n1. same refrigerator A1\n   Placement: unchanged\n   State: normal closed-door operation\n   Purpose: continuity\n2. subtle warm-zone emphasis\n   Placement: rear heat-rejection exterior area\n   State: soft translucent warm highlight, low intensity\n   Purpose: illustrate normal exterior warmth\nTECHNICAL OVERLAY\nType: subtle thermal emphasis\nElements:\n- soft warm highlight\nDirections:\n- none\nLabels:\n- none\nMust not imply:\n- do not imply fire, fault, dangerous overheating, glowing metal, or smoke\nALLOWED TRANSFORMS\n- add only a subtle warm-area highlight\nTECHNICAL CONSTRAINTS\n- Highlight must be visibly weaker than a warning/error visualization.\n- No component geometry changes.\n- No arrows required in this scene.\nCONTINUITY CONSTRAINTS\n- A0 is the authoritative geometry source.\n- A1 is the authoritative exterior scene reference.\n- Return to the same refrigerator without redesign or camera-family drift.\nNEGATIVE CONSTRAINTS\n- do not convert to French-door, side-by-side, single-door, or bottom-freezer layout\n- do not change body color to white or stainless steel\n- do not add external water/ice dispenser\n- do not add large protruding handles\n- do not change door proportions\n- do not invent a different appliance model\n- no flames\n- no smoke\n- no red-hot metal\n- no warning symbols\n- no camera change\n- no different kitchen\n- no additional technical parts\nOUTPUT\n1080x1920, aspect ratio 9:16\nOpaque background.\nFINAL RULE\nDo not create a new version of the primary subject. Treat A0 as the canonical geometry source and A1 as the scene-continuity source; edit only what is explicitly requested.",
  "negative_constraints": [
    "do not convert to French-door, side-by-side, single-door, or bottom-freezer layout",
    "do not change body color to white or stainless steel",
    "do not add external water/ice dispenser",
    "do not add large protruding handles",
    "do not change door proportions",
    "do not invent a different appliance model",
    "no flames",
    "no smoke",
    "no red-hot metal",
    "no warning symbols",
    "no camera change",
    "no different kitchen",
    "no additional technical parts"
  ],
  "continuity_constraints": [
    "A0 is the authoritative geometry source.",
    "A1 is the authoritative exterior scene reference.",
    "Return to the same refrigerator without redesign or camera-family drift."
  ],
  "technical_constraints": [
    "Highlight must be visibly weaker than a warning/error visualization.",
    "No component geometry changes.",
    "No arrows required in this scene."
  ],
  "output_spec": {
    "aspect_ratio": "9:16",
    "width": 1080,
    "height": 1920,
    "transparent_background": false
  },
  "status": "requires_user_action",
  "attempt": 0,
  "user_instructions": "Upload approved A0 and A1. Use A0 view(s) rear_left_45, rear to cross-check geometry while preserving A1 scene continuity; then import A6 for Visual QA.",
  "error": null,
  "prompt_spec_id": "IP6"
}